{
  "expected": {
    "signal": [
      1.3183898417423734e-16,
      0.07720627083999115,
      0.1539516420430928,
      0.22977796541310747,
      0.3042325792098981,
      0.37687101041216264,
      0.44725962809587005,
      0.5149782320884355,
      0.5796225614451033,
      0.640806707772639,
      0.6981654189934727,
      0.7513562797974676,
      0.800061755764639,
      0.8439910889559799,
      0.8828820336562601,
      0.9165024219068978,
      0.9446515494831167
    ]
  },
  "id": "smoke.rfft_inverse_forward_17",
  "inputs": {
    "imag": [
      0.0,
      0.15920962121835344,
      0.07427686802586989,
      0.046190491823674004,
      0.03130663523392168,
      0.021531824060758133,
      0.014190816472167307,
      0.008106640856101867,
      0.002639876583208761
    ],
    "real": [
      0.5389598321104785,
      -0.05468623367115226,
      -0.035010206548461494,
      -0.03151811103246355,
      -0.030317856555530764,
      -0.02977877491005096,
      -0.029504670809086045,
      -0.029362767979656135,
      -0.029301294548837967
    ]
  },
  "mapping": {
    "layout": "NumPy rfft: n//2+1 complex bins",
    "signal4s_normalization": "Forward"
  },
  "operation": "rfft.inverse",
  "params": {
    "length": 17,
    "normalization": "forward"
  },
  "scipy_api": "numpy.fft.irfft",
  "tolerance": {
    "atol": 1e-12,
    "rtol": 1e-10
  },
  "versions": {
    "gsignal": null,
    "numpy": "2.2.6",
    "scipy": "1.15.3"
  }
}
