{
  "expected": {
    "imag": [
      0.0,
      0.15920962121835344,
      0.07427686802586989,
      0.046190491823674004,
      0.03130663523392168,
      0.021531824060758133,
      0.014190816472167307,
      0.008106640856101867,
      0.002639876583208761
    ],
    "real": [
      0.5389598321104785,
      -0.05468623367115226,
      -0.035010206548461494,
      -0.03151811103246355,
      -0.030317856555530764,
      -0.02977877491005096,
      -0.029504670809086045,
      -0.029362767979656135,
      -0.029301294548837967
    ]
  },
  "id": "smoke.rfft_forward_prime_17",
  "inputs": {
    "signal": [
      0.0,
      0.0772062708399913,
      0.15395164204309297,
      0.22977796541310755,
      0.3042325792098981,
      0.3768710104121627,
      0.4472596280958701,
      0.5149782320884355,
      0.5796225614451034,
      0.6408067077726392,
      0.6981654189934727,
      0.7513562797974678,
      0.800061755764639,
      0.8439910889559799,
      0.8828820336562603,
      0.916502421906898,
      0.9446515494831169
    ]
  },
  "mapping": {
    "layout": "NumPy rfft: n//2+1 complex bins",
    "signal4s_normalization": "Forward"
  },
  "operation": "rfft.forward",
  "params": {
    "length": 17,
    "normalization": "forward"
  },
  "scipy_api": "numpy.fft.rfft",
  "tolerance": {
    "atol": 1e-12,
    "rtol": 1e-10
  },
  "versions": {
    "gsignal": null,
    "numpy": "2.2.6",
    "scipy": "1.15.3"
  }
}
