{
  "expected": {
    "freqz_mag": [
      1.0000000000000033,
      0.9999643610349924,
      0.9902795246029363,
      0.7962700645377998,
      0.35409214162251046,
      0.13529002250454086,
      0.05582849759252416,
      0.02456293516486006,
      0.011144925783573578,
      0.005055818132295666,
      0.0022216386888090564,
      0.000909768729429647,
      0.0003280963427893324,
      9.437591112782033e-05,
      1.7448226850400928e-05,
      1.0488115379185283e-06
    ],
    "impulse": [
      0.004824343357716229,
      0.03072871776808579,
      0.09059468195488289,
      0.16794482184473725,
      0.22464127134402823,
      0.2334571878676006,
      0.19351255216280544,
      0.12376524357101551,
      0.049603603138058325,
      -0.008509051874916712,
      -0.0406738350178055,
      -0.04756319794696737,
      -0.036851733822391416,
      -0.018562838524350346,
      -0.001252219126833697,
      0.010033162852733745
    ],
    "sos_flat": [
      0.004824343357716229,
      0.009648686715432458,
      0.004824343357716229,
      1.0,
      -1.0485995763626117,
      0.2961403575616696,
      1.0,
      2.0,
      1.0,
      1.0,
      -1.3209134308194264,
      0.6327387928852766
    ],
    "sosfreqz_mag": [
      1.0,
      0.9999643610349914,
      0.9902795246029378,
      0.7962700645378031,
      0.3540921416225108,
      0.13529002250454086,
      0.05582849759252414,
      0.024562935164860057,
      0.011144925783573574,
      0.005055818132295667,
      0.002221638688809059,
      0.0009097687294296474,
      0.00032809634278933256,
      9.437591112782087e-05,
      1.7448226850401314e-05,
      1.0488115379187811e-06
    ],
    "step": [
      0.004824343357716229,
      0.03555306112580202,
      0.1261477430806849,
      0.2940925649254222,
      0.5187338362694504,
      0.7521910241370509,
      0.9457035762998565,
      1.0694688198708722,
      1.1190724230089308,
      1.1105633711340144,
      1.0698895361162089,
      1.0223263381692413,
      0.9854746043468496,
      0.9669117658224988,
      0.9656595466956647,
      0.9756927095483977
    ],
    "zpk_gain": 0.004824343357716229,
    "zpk_poles_imag": [
      0.44332349357493983,
      0.1457741049525169,
      -0.1457741049525169,
      -0.44332349357493983
    ],
    "zpk_poles_real": [
      0.6604567154097132,
      0.5242997881813058,
      0.5242997881813058,
      0.6604567154097132
    ],
    "zpk_zeros_imag": [
      0.0,
      0.0,
      0.0,
      0.0
    ],
    "zpk_zeros_real": [
      -1.0,
      -1.0,
      -1.0,
      -1.0
    ]
  },
  "id": "smoke.butter_lowpass4_100hz",
  "inputs": {},
  "mapping": {
    "notes": "ZPK must match SciPy. SOS section order/pairing may differ; compare frequency and impulse responses rather than row-wise SOS.",
    "signal4s": "Butterworth.lowPass(4, Frequency(100), SampleRate(1000))"
  },
  "operation": "butter",
  "params": {
    "btype": "low",
    "cutoff_hz": 100.0,
    "order": 4,
    "sample_rate_hz": 1000.0
  },
  "scipy_api": "scipy.signal.butter / freqz / sosfreqz / dimpulse / dstep",
  "tolerance": {
    "atol": 1e-11,
    "rtol": 1e-09
  },
  "versions": {
    "gsignal": null,
    "numpy": "2.2.6",
    "scipy": "1.15.3"
  }
}
