{
  "expected": {
    "samples": [
      0.25,
      0.25,
      1.0,
      0.75,
      0.75,
      2.0,
      1.25,
      1.25,
      3.0,
      1.75,
      1.75,
      4.0
    ]
  },
  "id": "smoke.upfirdn_up3_down2",
  "inputs": {
    "h": [
      0.25,
      0.5,
      0.25
    ],
    "signal": [
      1.0,
      2.0,
      3.0,
      4.0,
      5.0,
      6.0,
      7.0,
      8.0
    ]
  },
  "mapping": {
    "notes": "Zero-insert between samples only (not after last), full FIR, keep every down-th sample from index 0. Streaming PolyphaseResampler.consume+flush matches this batch.",
    "signal4s": "Upfirdn(h, x, up=3, down=2)"
  },
  "operation": "upfirdn",
  "params": {
    "down": 2,
    "up": 3
  },
  "scipy_api": "scipy.signal.upfirdn",
  "tolerance": {
    "atol": 1e-14,
    "rtol": 1e-12
  },
  "versions": {
    "gsignal": null,
    "numpy": "2.2.6",
    "scipy": "1.15.3"
  }
}
