{
  "expected": {
    "imag": [
      0.0,
      1.5269550341683464,
      0.6970349066660144,
      0.40122848827421764,
      0.23141843593586625,
      0.10735968118446615,
      -1.1102230246251565e-16,
      -0.10735968118446615,
      -0.23141843593586625,
      -0.40122848827421786,
      -0.6970349066660143,
      -1.5269550341683462
    ],
    "real": [
      4.774228296111241,
      -0.5179365507800444,
      -0.4311052493666316,
      -0.41552154847743433,
      -0.41034769613319555,
      -0.40832078503013164,
      -0.40776463653636663,
      -0.4083207850301316,
      -0.41034769613319555,
      -0.41552154847743433,
      -0.43110524936663164,
      -0.5179365507800444
    ]
  },
  "id": "smoke.fft_forward_mixed_radix_12",
  "inputs": {
    "imag": [
      0.0,
      0.0,
      0.0,
      0.0,
      0.0,
      0.0,
      0.0,
      0.0,
      0.0,
      0.0,
      0.0,
      0.0
    ],
    "real": [
      0.0,
      0.0772062708399913,
      0.15395164204309297,
      0.22977796541310755,
      0.3042325792098981,
      0.3768710104121627,
      0.4472596280958701,
      0.5149782320884355,
      0.5796225614451034,
      0.6408067077726392,
      0.6981654189934727,
      0.7513562797974678
    ]
  },
  "mapping": {
    "signal4s_normalization": "Backward"
  },
  "operation": "fft.forward",
  "params": {
    "length": 12,
    "normalization": "backward"
  },
  "scipy_api": "numpy.fft.fft",
  "tolerance": {
    "atol": 1e-12,
    "rtol": 1e-10
  },
  "versions": {
    "gsignal": null,
    "numpy": "2.2.6",
    "scipy": "1.15.3"
  }
}
