{
  "expected": {
    "taps": [
      0.0,
      0.03806023374435663,
      0.14644660940672627,
      0.30865828381745514,
      0.5,
      0.6913417161825449,
      0.8535533905932737,
      0.9619397662556434,
      1.0,
      0.9619397662556434,
      0.8535533905932737,
      0.6913417161825451,
      0.5,
      0.30865828381745497,
      0.14644660940672627,
      0.03806023374435674
    ]
  },
  "id": "smoke.window_hann_periodic_16",
  "inputs": {},
  "mapping": {
    "fftbins_false": "Symmetric",
    "fftbins_true": "Periodic",
    "signal4s": "WindowSpec.Hann(n, WindowConvention.Periodic)"
  },
  "operation": "window",
  "params": {
    "convention": "Periodic",
    "fftbins": true,
    "length": 16,
    "name": "hann"
  },
  "scipy_api": "scipy.signal.get_window",
  "tolerance": {
    "atol": 1e-14,
    "rtol": 1e-12
  },
  "versions": {
    "gsignal": null,
    "numpy": "2.2.6",
    "scipy": "1.15.3"
  }
}
