{
  "expected": {
    "samples": [
      0.0,
      0.7071067811865475,
      1.0,
      0.7071067811865476,
      1.2246467991473532e-16,
      -0.7071067811865475,
      -1.0,
      -0.7071067811865477,
      -2.4492935982947064e-16,
      0.7071067811865467,
      1.0,
      0.7071067811865485,
      3.6739403974420594e-16,
      -0.7071067811865466,
      -1.0,
      -0.7071067811865485,
      -4.898587196589413e-16,
      0.7071067811865478,
      1.0,
      0.7071067811865486,
      6.123233995736766e-16,
      -0.7071067811865477,
      -1.0,
      -0.7071067811865487,
      -7.347880794884119e-16,
      0.7071067811865477,
      1.0,
      0.7071067811865488,
      8.572527594031472e-16,
      -0.7071067811865476,
      -1.0,
      -0.7071067811865488
    ]
  },
  "id": "smoke.sine_on_bin",
  "inputs": {},
  "notes": "Tone exactly on an FFT bin for length 32.",
  "operation": "signal.sine",
  "params": {
    "frequency_hz": 125.0,
    "length": 32,
    "sample_rate_hz": 1000.0
  },
  "scipy_api": "numpy.sin",
  "tolerance": {
    "atol": 1e-15,
    "rtol": 1e-15
  },
  "versions": {
    "gsignal": null,
    "numpy": "2.2.6",
    "scipy": "1.15.3"
  }
}
