{
  "expected": {
    "frequencies": [
      0.0,
      31.25,
      62.5,
      93.75,
      125.0,
      156.25,
      187.5,
      218.75,
      250.0,
      281.25,
      312.5,
      343.75,
      375.0,
      406.25,
      437.5,
      468.75,
      500.0
    ],
    "power": [
      0.00097717621863311,
      0.009634019445149284,
      0.005339034533995117,
      5.6574913623577546e-05,
      2.139912377052388e-06,
      2.895759238508994e-07,
      6.695020511081392e-08,
      2.0917555002103947e-08,
      7.90327743233352e-09,
      3.386419887000971e-09,
      1.575595685647953e-09,
      7.689181136620842e-10,
      3.8066894681780094e-10,
      1.8389852816006628e-10,
      8.25951058151922e-11,
      3.3971254879779425e-11,
      9.751535280995394e-12
    ]
  },
  "id": "smoke.welch_density_nodetrend",
  "inputs": {
    "signal": [
      0.0,
      0.2486898871648548,
      0.4817536741017153,
      0.6845471059286887,
      0.8443279255020151,
      0.9510565162951535,
      0.9980267284282716,
      0.9822872507286887,
      0.9048270524660195,
      0.7705132427757895,
      0.5877852522924732,
      0.36812455268467814,
      0.1253332335643041,
      -0.12533323356430384,
      -0.3681245526846779,
      -0.587785252292473,
      -0.7705132427757894,
      -0.9048270524660198,
      -0.9822872507286885,
      -0.9980267284282716,
      -0.9510565162951536,
      -0.844327925502015,
      -0.684547105928689,
      -0.4817536741017153,
      -0.2486898871648545,
      -2.4492935982947064e-16,
      0.24868988716485402,
      0.4817536741017149,
      0.6845471059286886,
      0.8443279255020152,
      0.9510565162951535,
      0.9980267284282716,
      0.9822872507286886,
      0.9048270524660192,
      0.7705132427757886,
      0.5877852522924734,
      0.3681245526846796,
      0.12533323356430567,
      -0.12533323356430318,
      -0.36812455268467725,
      -0.5877852522924728,
      -0.7705132427757893,
      -0.9048270524660197,
      -0.9822872507286885,
      -0.9980267284282716,
      -0.9510565162951538,
      -0.8443279255020151,
      -0.6845471059286885,
      -0.48175367410171477,
      -0.2486898871648556,
      -4.898587196589413e-16,
      0.24868988716485294,
      0.4817536741017139,
      0.6845471059286877,
      0.8443279255020146,
      0.9510565162951534,
      0.9980267284282716,
      0.9822872507286886,
      0.9048270524660194,
      0.7705132427757898,
      0.5877852522924736,
      0.3681245526846782,
      0.12533323356430415,
      -0.12533323356430293,
      -0.3681245526846787,
      -0.5877852522924726,
      -0.7705132427757901,
      -0.9048270524660196,
      -0.982287250728689,
      -0.9980267284282716,
      -0.9510565162951538,
      -0.8443279255020162,
      -0.6845471059286913,
      -0.48175367410171654,
      -0.24868988716485754,
      -7.347880794884119e-16,
      0.24868988716485269,
      0.48175367410171527,
      0.6845471059286876,
      0.8443279255020154,
      0.9510565162951533,
      0.9980267284282717,
      0.9822872507286887,
      0.9048270524660187,
      0.7705132427757888,
      0.5877852522924738,
      0.3681245526846801,
      0.12533323356430792,
      -0.12533323356430268,
      -0.36812455268467514,
      -0.5877852522924725,
      -0.7705132427757878,
      -0.9048270524660195,
      -0.9822872507286884,
      -0.9980267284282716,
      -0.9510565162951539,
      -0.8443279255020144,
      -0.6845471059286888,
      -0.48175367410171677,
      -0.24868988716485435,
      -9.797174393178826e-16,
      0.2486898871648559,
      0.4817536741017119,
      0.6845471059286874,
      0.8443279255020134,
      0.9510565162951533,
      0.9980267284282714,
      0.9822872507286887,
      0.9048270524660202,
      0.770513242775789,
      0.587785252292474,
      0.368124552684677,
      0.12533323356430462,
      -0.12533323356430245,
      -0.36812455268467825,
      -0.5877852522924722,
      -0.7705132427757899,
      -0.9048270524660194,
      -0.9822872507286883,
      -0.9980267284282718,
      -0.951056516295154,
      -0.8443279255020165,
      -0.6845471059286891,
      -0.481753674101717,
      -0.2486898871648546,
      -1.2246467991473533e-15,
      0.2486898871648522,
      0.4817536741017148
    ]
  },
  "mapping": {
    "signal4s": "WelchPlan(..., detrend=None, scaling=Density)"
  },
  "operation": "welch",
  "params": {
    "average": "mean",
    "detrend": "none",
    "nfft": 32,
    "noverlap": 16,
    "nperseg": 32,
    "sample_rate_hz": 1000.0,
    "scaling": "density",
    "sides": "onesided",
    "window": "hann_periodic"
  },
  "scipy_api": "scipy.signal.welch",
  "tolerance": {
    "atol": 1e-12,
    "rtol": 1e-09
  },
  "versions": {
    "gsignal": null,
    "numpy": "2.2.6",
    "scipy": "1.15.3"
  }
}
