{
  "expected": {
    "samples": [
      0.0,
      0.019301567709997827,
      0.0770910459307689,
      0.1537218800848212,
      0.22943503801980153,
      0.3037785335612666,
      0.37630855703252336,
      0.4465921246730846,
      0.5142096634294611,
      0.5787575156878204,
      0.6398503489959636,
      0.6971234563892631,
      0.7502349335882619,
      0.7988677200706814,
      0.8427314918332147,
      0.8815643945438496,
      0.9151346067382933,
      0.9432417237286572,
      0.9657179539628574,
      0.982429120692802,
      0.9932754629716917,
      0.9981922311987038,
      0.9971500736558254,
      0.9901552117293235,
      0.977249402769824,
      0.9585096908127205,
      0.9340479466470369,
      0.9040101999784044,
      0.8685757676729523,
      0.8279561832862489,
      0.7823939342677044,
      0.7321610143789661
    ]
  },
  "id": "smoke.lfilter_fir_causal",
  "inputs": {
    "a": [
      1.0
    ],
    "b": [
      0.25,
      0.5,
      0.25
    ],
    "signal": [
      0.0,
      0.0772062708399913,
      0.15395164204309297,
      0.22977796541310755,
      0.3042325792098981,
      0.3768710104121627,
      0.4472596280958701,
      0.5149782320884355,
      0.5796225614451034,
      0.6408067077726392,
      0.6981654189934727,
      0.7513562797974678,
      0.800061755764639,
      0.8439910889559799,
      0.8828820336562603,
      0.916502421906898,
      0.9446515494831169,
      0.9671613740414973,
      0.9838975182853179,
      0.9947600721590744,
      0.9996841892832999,
      0.9986404740691407,
      0.9916351572017208,
      0.9787100584447117,
      0.9599423369881517,
      0.9354440308298672,
      0.9053613879402618,
      0.869873993203227,
      0.8291936963450932,
      0.7835633472515822,
      0.7332553462225601,
      0.6785700178191616
    ]
  },
  "mapping": {
    "signal4s": "Fir.causal(b).process(signal)"
  },
  "operation": "lfilter.fir",
  "params": {},
  "scipy_api": "scipy.signal.lfilter",
  "tolerance": {
    "atol": 1e-14,
    "rtol": 1e-12
  },
  "versions": {
    "gsignal": null,
    "numpy": "2.2.6",
    "scipy": "1.15.3"
  }
}
