{
  "expected": {
    "samples": [
      0.0,
      0.07697599298658975,
      0.1534924610300532,
      0.22909262242142273,
      0.3033251655437145,
      0.37574694307484946,
      0.4459256174520384,
      0.5134422418049568,
      0.5778937609502663,
      0.6388954175172527,
      0.696083048840688,
      0.7491152609091171,
      0.7976754663907097,
      0.8414737745702401,
      0.8802487219148019,
      0.9137688329372734,
      0.9418340020396163,
      0.9642766880867935,
      0.9809629145800383,
      0.9917930694587223,
      0.9967024997562313,
      0.9956618975599195,
      0.9886774749710742,
      0.975790927020423,
      0.9570791827605756,
      0.9326539460212997,
      0.9026610285691995,
      0.8672794796526395,
      0.8267205171282886,
      0.7812262665501559,
      0.7313214952111996,
      0.6785700178191616
    ]
  },
  "id": "smoke.filtfilt_fir_odd",
  "inputs": {
    "a": [
      1.0
    ],
    "b": [
      0.25,
      0.5,
      0.25
    ],
    "signal": [
      0.0,
      0.0772062708399913,
      0.15395164204309297,
      0.22977796541310755,
      0.3042325792098981,
      0.3768710104121627,
      0.4472596280958701,
      0.5149782320884355,
      0.5796225614451034,
      0.6408067077726392,
      0.6981654189934727,
      0.7513562797974678,
      0.800061755764639,
      0.8439910889559799,
      0.8828820336562603,
      0.916502421906898,
      0.9446515494831169,
      0.9671613740414973,
      0.9838975182853179,
      0.9947600721590744,
      0.9996841892832999,
      0.9986404740691407,
      0.9916351572017208,
      0.9787100584447117,
      0.9599423369881517,
      0.9354440308298672,
      0.9053613879402618,
      0.869873993203227,
      0.8291936963450932,
      0.7835633472515822,
      0.7332553462225601,
      0.6785700178191616
    ]
  },
  "mapping": {
    "notes": "Matches SciPy padtype='odd' with default padlen.",
    "signal4s": "ZeroPhase.filter(..., EdgeTreatment.OddPad)"
  },
  "operation": "filtfilt",
  "params": {
    "method": "pad",
    "padtype": "odd"
  },
  "scipy_api": "scipy.signal.filtfilt",
  "tolerance": {
    "atol": 1e-11,
    "rtol": 1e-09
  },
  "versions": {
    "gsignal": null,
    "numpy": "2.2.6",
    "scipy": "1.15.3"
  }
}
