{
  "expected": {
    "imag": [
      0.0,
      0.6585537300492242,
      0.28666921896069847,
      0.18386192198535387,
      0.13362710073799183,
      0.10319060355545524,
      0.08239155444954734,
      0.06700551773320625,
      0.054950105296970767,
      0.045074357387079135,
      0.03668608883668707,
      0.029340071899793277,
      0.02273288848480841,
      0.016646307308598975,
      0.010914563980282137,
      0.005404102070333999,
      0.0
    ],
    "real": [
      4.02556069886479,
      -0.8052089808145904,
      -0.22131589801419624,
      -0.1283565372064077,
      -0.0967968075196955,
      -0.08237562051015848,
      -0.07461130342654901,
      -0.06997361928746901,
      -0.06700180828474855,
      -0.06500268230594757,
      -0.0636135651979482,
      -0.06263058900192861,
      -0.061933028140060346,
      -0.06144693503292284,
      -0.06112649662234803,
      -0.06094406883635811,
      -0.06088481846213233
    ]
  },
  "id": "smoke.rfft_forward_norm_ortho_32",
  "inputs": {
    "signal": [
      0.0,
      0.0772062708399913,
      0.15395164204309297,
      0.22977796541310755,
      0.3042325792098981,
      0.3768710104121627,
      0.4472596280958701,
      0.5149782320884355,
      0.5796225614451034,
      0.6408067077726392,
      0.6981654189934727,
      0.7513562797974678,
      0.800061755764639,
      0.8439910889559799,
      0.8828820336562603,
      0.916502421906898,
      0.9446515494831169,
      0.9671613740414973,
      0.9838975182853179,
      0.9947600721590744,
      0.9996841892832999,
      0.9986404740691407,
      0.9916351572017208,
      0.9787100584447117,
      0.9599423369881517,
      0.9354440308298672,
      0.9053613879402618,
      0.869873993203227,
      0.8291936963450932,
      0.7835633472515822,
      0.7332553462225601,
      0.6785700178191616
    ]
  },
  "mapping": {
    "layout": "NumPy rfft: n//2+1 complex bins",
    "signal4s_normalization": "Orthonormal"
  },
  "operation": "rfft.forward",
  "params": {
    "length": 32,
    "normalization": "ortho"
  },
  "scipy_api": "numpy.fft.rfft",
  "tolerance": {
    "atol": 1e-12,
    "rtol": 1e-10
  },
  "versions": {
    "gsignal": null,
    "numpy": "2.2.6",
    "scipy": "1.15.3"
  }
}
