{
  "expected": {
    "imag": [
      0.0,
      3.2281488633294293e-16,
      -2.0,
      -5.901772381999751e-16,
      -5.551115123125783e-17,
      -4.677125582852396e-16,
      -2.220446049250313e-16,
      2.003502064182077e-16,
      0.0,
      -2.003502064182076e-16,
      2.220446049250313e-16,
      4.677125582852397e-16,
      5.551115123125783e-17,
      5.90177238199975e-16,
      2.0,
      -3.2281488633294303e-16
    ],
    "real": [
      5.721188726109833e-18,
      6.123233995736766e-17,
      -9.687432492139905e-16,
      6.123233995736766e-17,
      6.123233995736766e-17,
      6.123233995736766e-17,
      6.013492094697846e-16,
      6.123233995736766e-17,
      1.167434911886255e-16,
      6.123233995736766e-17,
      6.013492094697846e-16,
      6.123233995736766e-17,
      6.123233995736766e-17,
      6.123233995736766e-17,
      -9.687432492139905e-16,
      6.123233995736766e-17
    ]
  },
  "id": "smoke.fft_forward_norm_ortho_16",
  "inputs": {
    "imag": [
      0.0,
      0.0,
      0.0,
      0.0,
      0.0,
      0.0,
      0.0,
      0.0,
      0.0,
      0.0,
      0.0,
      0.0,
      0.0,
      0.0,
      0.0,
      0.0
    ],
    "real": [
      0.0,
      0.7071067811865475,
      1.0,
      0.7071067811865476,
      1.2246467991473532e-16,
      -0.7071067811865475,
      -1.0,
      -0.7071067811865477,
      -2.4492935982947064e-16,
      0.7071067811865467,
      1.0,
      0.7071067811865485,
      3.6739403974420594e-16,
      -0.7071067811865466,
      -1.0,
      -0.7071067811865485
    ]
  },
  "mapping": {
    "signal4s_normalization": "Orthonormal"
  },
  "operation": "fft.forward",
  "params": {
    "length": 16,
    "normalization": "ortho"
  },
  "scipy_api": "numpy.fft.fft",
  "tolerance": {
    "atol": 1e-12,
    "rtol": 1e-10
  },
  "versions": {
    "gsignal": null,
    "numpy": "2.2.6",
    "scipy": "1.15.3"
  }
}
