{
  "expected": {
    "samples": [
      0.05675849221461389,
      0.7634807949772031,
      0.9856451861716296,
      0.4698263330718408,
      -0.3815954649144032,
      -0.9587915426933835,
      -0.8315494709410678,
      -0.09868743836008602,
      0.7079363026094543,
      0.9960495631818412,
      0.5561493182757348,
      -0.29070144999724873,
      -0.9248425160980983,
      -0.8822495944186022,
      -0.1962443349771406,
      0.6370072932540435,
      0.99775427831679,
      0.6397760767119905,
      -0.20278445929891784,
      -0.871197570462573,
      -0.9440170059212059,
      -0.25198626053899725
    ]
  },
  "id": "smoke.resample_poly_up2_down3",
  "inputs": {
    "signal": [
      0.0,
      0.5555702330196022,
      0.9238795325112867,
      0.9807852804032304,
      0.7071067811865476,
      0.1950903220161286,
      -0.38268343236508967,
      -0.8314696123025452,
      -1.0,
      -0.8314696123025455,
      -0.3826834323650904,
      0.19509032201612736,
      0.7071067811865474,
      0.9807852804032305,
      0.9238795325112867,
      0.5555702330196038,
      3.6739403974420594e-16,
      -0.5555702330196032,
      -0.9238795325112864,
      -0.9807852804032307,
      -0.7071067811865485,
      -0.19509032201612808,
      0.38268343236508806,
      0.831469612302545,
      1.0,
      0.8314696123025457,
      0.3826834323650891,
      -0.195090322016127,
      -0.7071067811865477,
      -0.9807852804032301,
      -0.9238795325112882,
      -0.5555702330196041
    ]
  },
  "mapping": {
    "notes": "Includes SciPy filter *up gain, pre-pad centering, and output trim.",
    "signal4s": "ResamplePoly(signal, up, down)"
  },
  "operation": "resample_poly",
  "params": {
    "down": 3,
    "padtype": "constant",
    "up": 2,
    "window": [
      "kaiser",
      5.0
    ]
  },
  "scipy_api": "scipy.signal.resample_poly",
  "tolerance": {
    "atol": 1e-10,
    "rtol": 1e-08
  },
  "versions": {
    "gsignal": null,
    "numpy": "2.2.6",
    "scipy": "1.15.3"
  }
}
