{
  "expected": {
    "samples": [
      0.0,
      0.0038603135419995657,
      0.022975802622699923,
      0.07194214478332212,
      0.16421436130539585,
      0.31173862447033895,
      0.5246267246797217,
      0.8108801486009728,
      1.1761694602733586,
      1.6236733127322356,
      2.1539799808448237,
      2.76505283034392,
      3.4522596573579802,
      4.208464380381564,
      5.024178174643812,
      5.887765837277691,
      6.7857019880281895,
      7.702870668755515,
      8.622901026333823,
      9.5285310643242,
      10.401990941289988,
      11.225396985582083,
      11.98114749100696,
      12.652311453572308,
      13.223001700593867,
      13.678724339708031,
      14.006697102700269,
      14.196129959917796,
      14.238462314694422,
      14.127552130425013,
      13.859813470445518,
      13.434300116072729
    ]
  },
  "id": "smoke.sosfilt_near_unit_circle",
  "inputs": {
    "signal": [
      0.0,
      0.0772062708399913,
      0.15395164204309297,
      0.22977796541310755,
      0.3042325792098981,
      0.3768710104121627,
      0.4472596280958701,
      0.5149782320884355,
      0.5796225614451034,
      0.6408067077726392,
      0.6981654189934727,
      0.7513562797974678,
      0.800061755764639,
      0.8439910889559799,
      0.8828820336562603,
      0.916502421906898,
      0.9446515494831169,
      0.9671613740414973,
      0.9838975182853179,
      0.9947600721590744,
      0.9996841892832999,
      0.9986404740691407,
      0.9916351572017208,
      0.9787100584447117,
      0.9599423369881517,
      0.9354440308298672,
      0.9053613879402618,
      0.869873993203227,
      0.8291936963450932,
      0.7835633472515822,
      0.7332553462225601,
      0.6785700178191616
    ],
    "sos_flat": [
      0.05,
      0.1,
      0.05,
      1.0,
      -1.9577667343133636,
      0.9801
    ]
  },
  "notes": "Poles near the unit circle; numerical stress fixture.",
  "operation": "sosfilt",
  "params": {
    "n_sections": 1,
    "pole_radius": 0.99,
    "theta": 0.15
  },
  "scipy_api": "scipy.signal.sosfilt",
  "tolerance": {
    "atol": 1e-11,
    "rtol": 1e-09
  },
  "versions": {
    "gsignal": null,
    "numpy": "2.2.6",
    "scipy": "1.15.3"
  }
}
