{
  "expected": {
    "imag": [
      0.0,
      -4.85722573273506e-17,
      1.962615573354719e-17,
      -5.3130099274908836e-17,
      0.0,
      3.469446951953614e-17,
      1.962615573354719e-17,
      9.238241074200322e-17,
      0.0,
      3.469446951953614e-17,
      -1.962615573354719e-17,
      2.5374523659279922e-17,
      0.0,
      -2.0816681711721685e-17,
      -1.962615573354719e-17,
      -6.46268351263743e-17
    ],
    "real": [
      5.551115123125783e-17,
      0.07720627083999132,
      0.15395164204309297,
      0.22977796541310763,
      0.3042325792098982,
      0.37687101041216275,
      0.44725962809587017,
      0.5149782320884356,
      0.5796225614451034,
      0.6408067077726393,
      0.6981654189934726,
      0.751356279797468,
      0.8000617557646391,
      0.84399108895598,
      0.8828820336562603,
      0.9165024219068981
    ]
  },
  "id": "smoke.fft_inverse_forward_16",
  "inputs": {
    "imag": [
      0.0,
      0.15446583747114886,
      0.072002226465637,
      0.04439500168430669,
      0.029608738826571,
      0.019767547615486172,
      0.012249151376191404,
      0.005881089263643155,
      0.0,
      -0.005881089263643141,
      -0.012249151376191404,
      -0.01976754761548618,
      -0.029608738826571,
      -0.044395001684306684,
      -0.072002226465637,
      -0.1544658374711489
    ],
    "real": [
      0.5136040997746887,
      -0.051686715535022236,
      -0.03511229982466487,
      -0.03215924446485334,
      -0.031146364148065972,
      -0.030695363829758515,
      -0.03047167186651435,
      -0.030364316531641747,
      -0.03033214737364659,
      -0.03036431653164174,
      -0.03047167186651435,
      -0.03069536382975852,
      -0.031146364148065972,
      -0.032159244464853354,
      -0.03511229982466487,
      -0.05168671553502224
    ]
  },
  "mapping": {
    "signal4s_normalization": "Forward"
  },
  "operation": "fft.inverse",
  "params": {
    "length": 16,
    "normalization": "forward"
  },
  "scipy_api": "numpy.fft.ifft",
  "tolerance": {
    "atol": 1e-12,
    "rtol": 1e-10
  },
  "versions": {
    "gsignal": null,
    "numpy": "2.2.6",
    "scipy": "1.15.3"
  }
}
