{
  "expected": {
    "imag": [
      -6.938893903907228e-18,
      6.148576292826383e-17,
      4.720141051520389e-18,
      2.305847488720866e-17,
      -2.688821387764051e-17,
      -5.253981799090778e-18,
      -4.1628258818030234e-18,
      1.1209796790391313e-18,
      6.938893903907228e-18,
      1.365154403654118e-17,
      2.2187528523868397e-18,
      2.8983229392095555e-17,
      0.0,
      -2.8249961742270865e-17,
      4.1628258818030234e-18,
      1.2756808128775325e-17,
      -6.938893903907228e-18,
      -4.953653953425182e-17,
      -9.157646756294068e-18,
      -2.5513782440141938e-17,
      2.688821387764051e-17,
      -3.300955741471969e-17,
      -4.1628258818030234e-18,
      1.1209796790391313e-18,
      6.938893903907228e-18,
      1.365154403654118e-17,
      2.2187528523868397e-18,
      -2.6527921839162275e-17,
      0.0,
      2.7261189488986962e-17,
      4.1628258818030234e-18,
      -1.4998767486853587e-17
    ],
    "real": [
      2.220446049250313e-16,
      0.07720627083999132,
      0.15395164204309292,
      0.22977796541310758,
      0.30423257920989816,
      0.37687101041216275,
      0.44725962809586983,
      0.5149782320884356,
      0.5796225614451035,
      0.6408067077726392,
      0.6981654189934727,
      0.7513562797974678,
      0.8000617557646391,
      0.8439910889559799,
      0.8828820336562602,
      0.916502421906898,
      0.9446515494831169,
      0.9671613740414972,
      0.9838975182853178,
      0.9947600721590744,
      0.9996841892832999,
      0.9986404740691407,
      0.9916351572017206,
      0.9787100584447118,
      0.9599423369881518,
      0.935444030829867,
      0.9053613879402618,
      0.8698739932032271,
      0.8291936963450933,
      0.7835633472515822,
      0.73325534622256,
      0.6785700178191616
    ]
  },
  "id": "smoke.fft_inverse_backward_32",
  "inputs": {
    "imag": [
      0.0,
      3.725342466348012,
      1.6216459894764887,
      1.0400800947026854,
      0.7559090326570556,
      0.5837342042303604,
      0.4660770149102046,
      0.37904044772852474,
      0.31084473665922285,
      0.25497907012823673,
      0.20752785753306818,
      0.1659725104067576,
      0.1285966368285248,
      0.09416573423700425,
      0.06174209763321559,
      0.030570217761259233,
      0.0,
      -0.030570217761259455,
      -0.061742097633215476,
      -0.09416573423700425,
      -0.12859663682852485,
      -0.1659725104067576,
      -0.20752785753306824,
      -0.25497907012823684,
      -0.31084473665922285,
      -0.37904044772852463,
      -0.46607701491020465,
      -0.5837342042303604,
      -0.7559090326570554,
      -1.0400800947026854,
      -1.6216459894764887,
      -3.7253424663480117
    ],
    "real": [
      22.772010145962803,
      -4.554949844850444,
      -1.2519517781618283,
      -0.7260942229461937,
      -0.5475654319550853,
      -0.4659868789374617,
      -0.4220652688486392,
      -0.395830565618681,
      -0.3790194639192537,
      -0.3677106996308026,
      -0.35985266661537396,
      -0.35429211354377077,
      -0.35034611341803157,
      -0.34759635555927154,
      -0.3457836821747111,
      -0.34475171477830857,
      -0.34441654404708544,
      -0.34475171477830857,
      -0.345783682174711,
      -0.34759635555927154,
      -0.3503461134180316,
      -0.35429211354377077,
      -0.3598526666153739,
      -0.3677106996308027,
      -0.3790194639192537,
      -0.39583056561868113,
      -0.42206526884863926,
      -0.4659868789374617,
      -0.5475654319550854,
      -0.7260942229461937,
      -1.2519517781618283,
      -4.554949844850444
    ]
  },
  "mapping": {
    "signal4s_normalization": "Backward"
  },
  "operation": "fft.inverse",
  "params": {
    "length": 32,
    "normalization": "backward"
  },
  "scipy_api": "numpy.fft.ifft",
  "tolerance": {
    "atol": 1e-12,
    "rtol": 1e-10
  },
  "versions": {
    "gsignal": null,
    "numpy": "2.2.6",
    "scipy": "1.15.3"
  }
}
